		Phase	http://purl.org/net/OCRe/study_design.owl#OCRE100038	"Phase describes the level of a trial required of drugs before (and after) they are routinely used in clinical practice: 
- Phase I trials assess toxic effects on humans (not many people participate in them, and usually without controls); 
- Phase ll trials assess therapeutic benefit (usually involving a few hundred people, usually with controls, but not always); 
- Phase III trials compare the new treatment against standard (or placebo) treatment (usually a full randomised controlled trial). At this point, a drug can be approved for community use. 
- Phase IV monitors a new treatment in the community, often to evaluate longterm safety and effectiveness. [Glossary of Terms in The Cochrane Collaboration]

A trial can be of a combination phase (e.g., I/II).
The concept of phase is not applicable to trials studying certain interventions (e.g., device, procedure, behavioral)"
		phase	http://purl.obolibrary.org/obo/PATO_0000083	A quality that exists by virtue of being a particular point in the time of a cycle.
		Phase	http://ensembl.org/glossary/ENSGLOSSARY_0000075	The position of an exon/intron boundary within a codon. A phase of zero means the boundary falls between codons, one means between the first and second base and two means between the second and third base. Exons have a start and end phase, whereas introns have just one phase. A boundary in a non-coding region has a phase of -1.
		Trial Phase	http://purl.obolibrary.org/obo/NCIT_C48281	Clinical trials are broken into three or four phases: Phase I tests a new drug or treatment for safety in a small group; Phase II expands the study to a larger group of people; Phase III expands the study to an even larger group of people to measure whether the treatment actually benefits patients, and whether its benefits exceed its risks; and Phase IV takes place after the drug or treatment has been licensed and marketed.
MTBLS280	control	Yes or No Response	http://ncicb.nci.nih.gov/xml/owl/EVS/Thesaurus.owl#C38147	
		Control	http://purl.obolibrary.org/obo/NCIT_C61299	The act of directing or determining; regulation or maintenance of a function or action; a relation of constraint of one entity (thing or person or group) by another.
		control	http://www.ebi.ac.uk/efo/EFO_0001461	The act of directing or determining; regulation or maintenance of a function or action; a relation of constraint of one entity (thing or person or group) by another.
		control	http://biomodels.net/SBO/SBO_0000168	Synonym: regulation 
		Scientific Control	http://purl.obolibrary.org/obo/NCIT_C64355	Methodology that tests integrity in experiments by isolating variables as dictated by the scientific method in order to make a conclusion about such variables. In a controlled experiment, two virtually identical experiments are conducted, but the factor being tested is varied in only one of them. This serves to isolate any causal phenomena.
		True Control Status	http://purl.obolibrary.org/obo/NCIT_C99270	The participant is a true control for the phenotype under consideration.
		Control Group	http://purl.obolibrary.org/obo/NCIT_C28143	A group used as a standard of comparison in a control experiment.
		Study Control	http://purl.obolibrary.org/obo/NCIT_C142703	A comparator treatment in a clinical trial against which the treatment under study is evaluated. (ICH)
MTBLS280	phase	phase	http://ncicb.nci.nih.gov/xml/owl/EVS/Thesaurus.owl#C25257	
		Phase	http://purl.obolibrary.org/obo/NCIT_C25257	A distinguishable part, a stage in a series of events or in a process of development, e.g. any of the varying aspects or stages in course of a disease; a fraction of a cycle.
		Translation phase specification	http://edamontology.org/data_2336	
		Phase	http://purl.org/net/OCRe/study_design.owl#OCRE100038	"Phase describes the level of a trial required of drugs before (and after) they are routinely used in clinical practice: 
- Phase I trials assess toxic effects on humans (not many people participate in them, and usually without controls); 
- Phase ll trials assess therapeutic benefit (usually involving a few hundred people, usually with controls, but not always); 
- Phase III trials compare the new treatment against standard (or placebo) treatment (usually a full randomised controlled trial). At this point, a drug can be approved for community use. 
- Phase IV monitors a new treatment in the community, often to evaluate longterm safety and effectiveness. [Glossary of Terms in The Cochrane Collaboration]

A trial can be of a combination phase (e.g., I/II).
The concept of phase is not applicable to trials studying certain interventions (e.g., device, procedure, behavioral)"
		phase	http://purl.obolibrary.org/obo/PATO_0000083	A quality that exists by virtue of being a particular point in the time of a cycle.
		Phase	http://ensembl.org/glossary/ENSGLOSSARY_0000075	The position of an exon/intron boundary within a codon. A phase of zero means the boundary falls between codons, one means between the first and second base and two means between the second and third base. Exons have a start and end phase, whereas introns have just one phase. A boundary in a non-coding region has a phase of -1.
		Trial Phase	http://purl.obolibrary.org/obo/NCIT_C48281	Clinical trials are broken into three or four phases: Phase I tests a new drug or treatment for safety in a small group; Phase II expands the study to a larger group of people; Phase III expands the study to an even larger group of people to measure whether the treatment actually benefits patients, and whether its benefits exceed its risks; and Phase IV takes place after the drug or treatment has been licensed and marketed.
MTBLS281	Sample Type	sample	http://purl.obolibrary.org/obo/MS_1000457	
		Biospecimen Type	http://purl.obolibrary.org/obo/NCIT_C70713	The type of a material sample taken from a biological entity for testing, diagnostic, propagation, treatment or research purposes. This includes particular types of cellular molecules, cells, tissues, organs, body fluids, embryos, and body excretory substances.
MTBLS281	Replicate	biological replicate	http://www.ebi.ac.uk/efo/EFO_0002091	
		Replicate	http://purl.obolibrary.org/obo/NCIT_C28038	
		replicate	http://www.ebi.ac.uk/efo/EFO_0000683	
		Repeat	http://purl.obolibrary.org/obo/NCIT_C47886	Make or do or perform again.
MTBLS283	Timepoint	time	http://www.ebi.ac.uk/efo/EFO_0000721	
		Timepoint	http://purl.obolibrary.org/obo/NCIT_C68568	A specific point in the time continuum, including those established relative to an event.
		timepoint	http://www.ebi.ac.uk/efo/EFO_0000724	
MTBLS283	Batch	block	http://www.ebi.ac.uk/efo/EFO_0005067	
		Batch	http://purl.obolibrary.org/obo/NCIT_C67073	A quantity of people or things treated or regarded as a group, especially when subdivided from a larger group.
		block	http://www.ebi.ac.uk/efo/EFO_0005067	A block or batch is an experimental unit arrangement into a group which is similar to one another. Typically, a blocking factor is a source of variability that is not of primary interest to the experimenter. An example of a blocking factor might be the sex of a patient; by blocking on sex, this source of variability is controlled for, thus leading to greater accuracy.
		Batch Number	http://purl.obolibrary.org/obo/NCIT_C104504	A distinctive alpha-numeric identification code assigned by the manufacturer or distributor to a specific quantity of manufactured material or product that is produced in a manner that is expected to render it homogeneous.
MTBLS289	Specimen	Biospecimen	http://ncicb.nci.nih.gov/xml/owl/EVS/Thesaurus.owl#C70699	
		Specimen	http://purl.obolibrary.org/obo/NCIT_C19157	A part of a thing, or of several things, taken to demonstrate or to determine the character of the whole, e.g. a substance, or portion of material obtained for use in testing, examination, or study; particularly, a preparation of tissue or bodily fluid taken for examination or diagnosis.
		specimen	http://purl.obolibrary.org/obo/OBI_0100051	A material entity that has the specimen role.
		Specimen	http://purl.org/dsw/Specimen	
		specimen	http://semanticscience.org/resource/SIO_010412	A specimen is a portion of material for use in testing, examination, or study.
		CDISC SEND Biospecimens Terminology	http://purl.obolibrary.org/obo/NCIT_C77529	A terminology set that includes concepts relevant to CDISC SEND biospecimens.
		Biospecimen	http://purl.obolibrary.org/obo/NCIT_C70699	Any material sample taken from a biological entity for testing, diagnostic, propagation, treatment or research purposes, including a sample obtained from a living organism or taken from the biological object after halting of all its life functions. Biospecimen can contain one or more components including but not limited to cellular molecules, cells, tissues, organs, body fluids, embryos, and body excretory products.
MTBLS290	Sample type	Group	http://ncicb.nci.nih.gov/xml/owl/EVS/Thesaurus.owl#C43359	
		Biospecimen Type	http://purl.obolibrary.org/obo/NCIT_C70713	The type of a material sample taken from a biological entity for testing, diagnostic, propagation, treatment or research purposes. This includes particular types of cellular molecules, cells, tissues, organs, body fluids, embryos, and body excretory substances.
MTBLS291	Replicate	technical replicate	http://www.ebi.ac.uk/efo/EFO_0002090	
		Replicate	http://purl.obolibrary.org/obo/NCIT_C28038	
		replicate	http://www.ebi.ac.uk/efo/EFO_0000683	
		Repeat	http://purl.obolibrary.org/obo/NCIT_C47886	Make or do or perform again.
MTBLS292	siRNA	gene knockdown by siRNA transfection	http://www.bioassayontology.org/bao#BAO_0002438	
		siRNA	http://purl.obolibrary.org/obo/SO_0000646	A small RNA molecule that is the product of a longer exogenous or endogenous dsRNA, which is either a bimolecular duplex or very long hairpin, processed (via the Dicer pathway) such that numerous siRNAs accumulate from both strands of the dsRNA. SRNAs trigger the cleavage of their target molecules.
		siRNA	http://www.bioassayontology.org/bao#BAO_0000324	In the RNAi pathway,  the double stranded RNAs first get processed into 20-25 nucleotide small interfering RNAs (siRNAs) by an RNase III-like enzyme called Dicer. The siRNAs enter into endoribonuclease-containing complexes known as RNA-induced silencing complexes (RISCs), and bring about the cleavage of the target mRNAs to achieve gene silencing.
		siRNA	http://ensembl.org/glossary/ENSGLOSSARY_0000041	A small RNA (20-25bp) that silences the expression of target mRNA through the RNAi pathway.
		Small Interfering RNA	http://purl.obolibrary.org/obo/NCIT_C2191	A 20 to 25-nucleotide double-stranded RNA which is involved in a sequence-specific messenger RNA degradation process known as RNA interference.
		Functional, regulatory and non-coding RNA	http://edamontology.org/topic_0659	Non-coding or functional RNA sequences, including regulatory RNA sequences, ribosomal RNA (rRNA) and transfer RNA (tRNA).
MTBLS293	replicate	biological replicate	http://www.ebi.ac.uk/efo/EFO_0002091	
		Replicate	http://purl.obolibrary.org/obo/NCIT_C28038	
		replicate	http://www.ebi.ac.uk/efo/EFO_0000683	
		Repeat	http://purl.obolibrary.org/obo/NCIT_C47886	Make or do or perform again.
MTBLS295	Sample Type	sample	http://purl.obolibrary.org/obo/MS_1000457	
		Biospecimen Type	http://purl.obolibrary.org/obo/NCIT_C70713	The type of a material sample taken from a biological entity for testing, diagnostic, propagation, treatment or research purposes. This includes particular types of cellular molecules, cells, tissues, organs, body fluids, embryos, and body excretory substances.
MTBLS297	Organ	plant organ	http://purl.obolibrary.org/obo/PO_0009008	
		Organ	http://purl.obolibrary.org/obo/NCIT_C13018	A unique macroscopic (gross) anatomic structure that performs specific functions. It is composed of various tissues.  An organ is part of an anatomic system or a body region. Representative examples include the heart, lung, liver, spleen, and uterus.
		compound organ	http://purl.obolibrary.org/obo/ZFA_0000496	Anatomical structure that has as its parts two or more multi-tissue structures of at least two different types and which through specific morphogenetic processes forms a single distinct structural unit demarcated by bona fide boundaries from other distinct anatomical structures of different types.
		organ	http://purl.obolibrary.org/obo/UBERON_0000062	Anatomical structure that performs a specific function or group of functions [WP].
		organ	http://purl.obolibrary.org/obo/ExO_0000044	
		Organ	http://purl.obolibrary.org/obo/FMA_67498	
		organ	http://purl.obolibrary.org/obo/MA_0003001	
		organ	http://semanticscience.org/resource/SIO_010003	An organ is a collection of tissues joined in structural unit to serve a common function.
		organ	http://purl.obolibrary.org/obo/ENVO_01000162	A collection of tissues joined in structural unit to serve a common function.
		organ	http://purl.obolibrary.org/obo/CARO_0020004	A multicellular anatomical structure largely delimited by a morphological boundary whose components work together to make the whole structure capable of a specific function.
		organ	http://purl.obolibrary.org/obo/WBbt_0003760	a collection of cells or cell groups that collectively perform a function
MTBLS298	Replicate	technical replicate	http://www.ebi.ac.uk/efo/EFO_0002090	
		Replicate	http://purl.obolibrary.org/obo/NCIT_C28038	
		replicate	http://www.ebi.ac.uk/efo/EFO_0000683	
		Repeat	http://purl.obolibrary.org/obo/NCIT_C47886	Make or do or perform again.
MTBLS298	Patient	Study Subject	http://ncicb.nci.nih.gov/xml/owl/EVS/Thesaurus.owl#C41189	
		Patient	http://purl.obolibrary.org/obo/NCIT_C16960	A person who receives medical attention, care, or treatment, or who is registered with medical professional or institution with the purpose to receive medical care when necessary.
		patient	http://purl.obolibrary.org/obo/IDOMAL_0000603	A person under health care. The person may be waiting for this care or may be receiving it or may have already received it.
		patient	http://purl.obolibrary.org/obo/AERO_0000270	
		patient	http://semanticscience.org/resource/SIO_000393	A patient is an individual that is the recepient of medical care.
		patient	http://purl.obolibrary.org/obo/OAE_0001817	an organism that has the role of 'patient role'.
		Veterinary Patient	http://purl.obolibrary.org/obo/NCIT_C53691	A non-human animal that is a subject in a study.
MTBLS303	Group	Group	http://ncicb.nci.nih.gov/xml/owl/EVS/Thesaurus.owl#C43359	
		group	http://purl.obolibrary.org/obo/CHEBI_24433	A defined linked collection of atoms or a single atom within a molecular entity.
		Group	http://purl.obolibrary.org/obo/NCIT_C43359	Any number of entities (members) considered as a unit.
		group	http://purl.obolibrary.org/obo/sep_00077	A group is a defnined collection of objects, e.g. a flock of sheep, a herd of goats, or the local Boy Scout troop.
		Group	http://purl.obolibrary.org/obo/GAZ_00378987	A river.
		Group Object	http://purl.obolibrary.org/obo/NCIT_C42685	The group object of the group which assumes the roles in context of a protection group.
		User Group	http://purl.obolibrary.org/obo/NCIT_C42684	A set of people who have similar interests, goals, or concerns.
		Population Group	http://purl.obolibrary.org/obo/NCIT_C17005	A group of individuals united by a common factor (e.g., geographic location, ethnicity, disease, age, gender)
		Stage Grouping	http://purl.obolibrary.org/obo/NCIT_C38027	An assessment based on the combined evaluation of the patient's T stage, M stage, and N stage, as well as prognostic parameters for specific cancers.
MTBLS304	Group	Group	http://ncicb.nci.nih.gov/xml/owl/EVS/Thesaurus.owl#C43359	
		group	http://purl.obolibrary.org/obo/CHEBI_24433	A defined linked collection of atoms or a single atom within a molecular entity.
		Group	http://purl.obolibrary.org/obo/NCIT_C43359	Any number of entities (members) considered as a unit.
		group	http://purl.obolibrary.org/obo/sep_00077	A group is a defnined collection of objects, e.g. a flock of sheep, a herd of goats, or the local Boy Scout troop.
		Group	http://purl.obolibrary.org/obo/GAZ_00378987	A river.
		Group Object	http://purl.obolibrary.org/obo/NCIT_C42685	The group object of the group which assumes the roles in context of a protection group.
		User Group	http://purl.obolibrary.org/obo/NCIT_C42684	A set of people who have similar interests, goals, or concerns.
		Population Group	http://purl.obolibrary.org/obo/NCIT_C17005	A group of individuals united by a common factor (e.g., geographic location, ethnicity, disease, age, gender)
		Stage Grouping	http://purl.obolibrary.org/obo/NCIT_C38027	An assessment based on the combined evaluation of the patient's T stage, M stage, and N stage, as well as prognostic parameters for specific cancers.
MTBLS306	Participant	Study Subject	http://ncicb.nci.nih.gov/xml/owl/EVS/Thesaurus.owl#C41189	
		Participant	http://purl.obolibrary.org/obo/NCIT_C29867	Someone who takes part in an activity.
		participant	http://biomodels.net/SBO/SBO_0000235	Entity that affects or is affected by an event.
		Study Participant	http://purl.obolibrary.org/obo/NCIT_C142710	Any individiual that has a role in a study, including study personnel and study subjects.
		Participant Object	http://purl.obolibrary.org/obo/NCIT_C79269	Something that takes part in an activity.
MTBLS306	Sampling time	timepoint	http://www.ebi.ac.uk/efo/EFO_0000724	
		sampling time	http://www.ebi.ac.uk/efo/EFO_0000689	
MTBLS307	Diabetes	Boolean	http://ncicb.nci.nih.gov/xml/owl/EVS/Thesaurus.owl#C45254	
		Diabetes Mellitus	http://purl.obolibrary.org/obo/NCIT_C2985	A metabolic disorder characterized by abnormally high blood sugar levels due to diminished production of insulin or insulin resistance/desensitization.
		diabetes mellitus	http://www.ebi.ac.uk/efo/EFO_0000400	A heterogeneous group of disorders characterized by HYPERGLYCEMIA and GLUCOSE INTOLERANCE.
MTBLS307	Gender	Gender	http://ncicb.nci.nih.gov/xml/owl/EVS/Thesaurus.owl#C17357	
		Gender	http://purl.obolibrary.org/obo/NCIT_C17357	The assemblage of properties that distinguish people on the basis of the societal roles expected for the two sexes.
		Gender	http://scdontology.h3abionet.org/ontology/SCDO_0001341	The respondent's self-conception of being male or female.
		Gender	http://purl.obolibrary.org/obo/GAZ_00325165	A river.
		Sex	http://purl.obolibrary.org/obo/NCIT_C28421	The assemblage of physical properties or qualities by which male is distinguished from female; the physical difference between male and female; the distinguishing peculiarity of male or female.
MTBLS309	Replicate	biological replicate	http://www.ebi.ac.uk/efo/EFO_0002091	
		Replicate	http://purl.obolibrary.org/obo/NCIT_C28038	
		replicate	http://www.ebi.ac.uk/efo/EFO_0000683	
		Repeat	http://purl.obolibrary.org/obo/NCIT_C47886	Make or do or perform again.
MTBLS309	Incubation	timepoint	http://www.ebi.ac.uk/efo/EFO_0000724	
		incubation	http://purl.bioontology.org/ontology/npo#NPO_2000	
MTBLS311	Incubation	timepoint	http://www.ebi.ac.uk/efo/EFO_0000724	
		incubation	http://purl.bioontology.org/ontology/npo#NPO_2000	
MTBLS311	Replicate	biological replicate	http://www.ebi.ac.uk/efo/EFO_0002091	
		Replicate	http://purl.obolibrary.org/obo/NCIT_C28038	
		replicate	http://www.ebi.ac.uk/efo/EFO_0000683	
		Repeat	http://purl.obolibrary.org/obo/NCIT_C47886	Make or do or perform again.
MTBLS312	Carbon dioxide treatment	concentration	http://purl.obolibrary.org/obo/CHMO_0002820	
		carbon dioxide treatment	http://purl.obolibrary.org/obo/EO_0001020	An inorganic gas treatment (EO:0001055) that involves the application of carbon dioxide (CHEBI:16526).
MTBLS312	Incubation	timepoint	http://www.ebi.ac.uk/efo/EFO_0000724	
		incubation	http://purl.bioontology.org/ontology/npo#NPO_2000	
MTBLS312	Replicate	biological replicate	http://www.ebi.ac.uk/efo/EFO_0002091	
		Replicate	http://purl.obolibrary.org/obo/NCIT_C28038	
		replicate	http://www.ebi.ac.uk/efo/EFO_0000683	
		Repeat	http://purl.obolibrary.org/obo/NCIT_C47886	Make or do or perform again.
MTBLS315	blood glucose	concentration	http://purl.obolibrary.org/obo/CHMO_0002820	
		Blood Glucose	http://purl.obolibrary.org/obo/NCIT_C94312	
		Blood Glucose	http://purl.obolibrary.org/obo/OMIT_0003146	
MTBLS315	platelet count	number density		
		Platelet Count	http://purl.obolibrary.org/obo/NCIT_C51951	The determination of the number of platelets in a blood sample, usually expressed as platelets per cubic millimeter (cmm) of whole blood.
		Platelet Count	http://scdontology.h3abionet.org/ontology/SCDO_0000906	The number of platelets (thrombocytes) in a specified volume of blood, usually expressed as platelets per cubic millimeter of whole blood.
		Platelet Count	http://purl.obolibrary.org/obo/OMIT_0011949	
		platelet count	http://www.ebi.ac.uk/efo/EFO_0004309	The number ofPLATELETSper unit volume in a sample of venousBLOOD.
		platelet count	http://purl.obolibrary.org/obo/CMO_0000029	The number of platelets (thrombocytes) in a specified volume of blood, usually expressed as platelets per cubic millimeter of whole blood.
		platelet quantity	http://purl.obolibrary.org/obo/VT_0003179	The proportion or number of the disc-like fragments of megakaryocytes that are found in the blood and function in clotting.
MTBLS315	mean corpuscular hemoglobin concentration	concentration	http://purl.obolibrary.org/obo/CHMO_0002820	
		Mean Corpuscular Hemoglobin Concentration	http://scdontology.h3abionet.org/ontology/SCDO_0000721	The amount of hemoglobin in a given volume of packed red blood cells and is often calculated by dividing the hemoglobin concentration by the hematocrit.
		mean corpuscular hemoglobin concentration	http://www.ebi.ac.uk/efo/EFO_0004528	The mean corpuscular hemoglobin concentration is a measure of the concentration of hemoglobin in a given volume of packed red blood cell
		mean corpuscular hemoglobin concentration	http://purl.obolibrary.org/obo/CMO_0000291	The amount of hemoglobin in a given volume of packed red blood cells and is often calculated by dividing the hemoglobin concentration by the hematocrit.
MTBLS315	mean corpuscular hemoglobin	mass	http://purl.obolibrary.org/obo/PATO_0000125	
		mean corpuscular hemoglobin	http://www.ebi.ac.uk/efo/EFO_0004527	The MCH is  the average mass of hemoglobin per red blood cell in a sample of blood and is calculated by dividing the total mass of hemoglobin by the RBC count
		abnormal mean corpuscular hemoglobin	http://purl.obolibrary.org/obo/MP_0001589	anomalies in the average levels of hemoglobin contained in an erythrocyte
MTBLS315	mean corpuscular volume	volume	http://www.ebi.ac.uk/efo/EFO_0001715	
		Mean Corpuscular Volume	http://scdontology.h3abionet.org/ontology/SCDO_0000723	A measure of the average volume or size of a single red blood cell. It is derived by dividing the total volume of packed red blood cells by the total red blood cell count.
		mean corpuscular volume	http://www.ebi.ac.uk/efo/EFO_0004526	A mean corpuscular volume is the result of calculation of the mean volume of erythrocytes in a blood sample.
		mean corpuscular volume	http://purl.obolibrary.org/obo/CMO_0000038	A measure of the average volume or size of a single red blood cell. It is derived by dividing the total volume of packed red blood cells by the total red blood cell count.
MTBLS315	hematocrit	volume per unit volume	http://purl.obolibrary.org/obo/UO_0000205	
		Hematocrit	http://scdontology.h3abionet.org/ontology/SCDO_0000503	Percentage of total blood volume that is made up of red blood cells.
		Hematocrit	http://purl.obolibrary.org/obo/OMIT_0007571	
		hematocrit	http://www.ebi.ac.uk/efo/EFO_0004348	The volume of packed RED BLOOD CELLS in a blood specimen. The volume is measured by centrifugation in a tube with graduated markings, or with automated blood cell counters. It is an indicator of erythrocyte status in disease. For example, ANEMIA shows a low value; POLYCYTHEMIA, a high value.
		hematocrit	http://purl.obolibrary.org/obo/CMO_0000037	Percentage of total blood volume that is made up of red blood cells.
		Hematocrit Measurement	http://purl.obolibrary.org/obo/NCIT_C64796	A measure of the volume of red blood cells expressed as a percentage of the total blood volume. Normal in males is 43-49%, in females 37-43%.
MTBLS315	hemoglobin	concentration	http://purl.obolibrary.org/obo/CHMO_0002820	
		hemoglobin	http://purl.obolibrary.org/obo/CHEBI_35143	
		Hemoglobin	http://purl.obolibrary.org/obo/NCIT_C16676	The red respiratory protein of erythrocytes, consisting of approximately 3.8% heme and 96.2% globin (64.5 KD), which as oxyhemoglobin (HbO2) transports oxygen from the lungs to the tissues where the oxygen is readily released and HbO2 becomes Hb.
		Hemoglobin	http://purl.obolibrary.org/obo/FMA_62293	
		Hemoglobin, CTCAE	http://purl.obolibrary.org/obo/NCIT_C55991	
		Hemoglobin Measurement	http://purl.obolibrary.org/obo/NCIT_C64848	A quantitative measurement of the amount of hemoglobin present in a sample.
MTBLS315	total white blood cell count	number density		
		Total White Blood Cell Count	http://scdontology.h3abionet.org/ontology/SCDO_0001163	The total number of leukocytes in 1 cubic millimeter of peripheral venous blood.
		total white blood cell count	http://purl.obolibrary.org/obo/CMO_0000365	The total number of leukocytes in 1 cubic millimeter of peripheral venous blood.
MTBLS315	height	body height	http://www.ebi.ac.uk/efo/EFO_0004339	
		Height	http://purl.obolibrary.org/obo/NCIT_C25347	The vertical measurement or distance from the base to the top of an object; the vertical dimension of extension.
		body height	http://www.ebi.ac.uk/efo/EFO_0004339	The distance from the sole to the crown of the head with body standing on a flat surface and fully extended.
		height	http://purl.obolibrary.org/obo/PATO_0000119	
		height	http://semanticscience.org/resource/SIO_000040	height is the one dimensional extent along the vertical projection of a 3D object from a base plane of reference.
